<?xml version="1.0" encoding="UTF-8"?>
<creatures xmlns="stendhal" xmlns:xsi="http://www.w3.org/2001/XMLSchema-instance"
	xsi:schemaLocation="stendhal ../../creatures.xsd ">

	<!-- START: kobold -->
	<creature name="kobold">
		<type class="kobold" subclass="kobold" tileid="kobold.png:1"/>
		<description>Oto kobold. We wsi gadają, że to mityczny duch.</description>
		<attributes>
			<atk value="80"/>
			<def value="16"/>
			<armor value="light"/>
			<hp value="50"/>
			<speed value="0.5"/>
			<size value="1,1"/>
		</attributes>
		<level value="5"/>
		<experience value="50"/>
		<respawn value="1200"/>
		<corpse name="humanoid"/>
		<drops>
			<item value="money" quantity="[2,6]" probability="90.0"/>
			<item value="skórzane spodnie" quantity="[1,1]" probability="10.0"/>
			<item value="skórzana zbroja" quantity="[1,1]" probability="10.0"/>
			<item value="skórzany kirys" quantity="[1,1]" probability="2.0"/>
			<item value="pas skórzany" quantity="[1,1]" probability="3.0"/>
			<item value="toporek" quantity="[1,1]" probability="1.3"/>
			<item value="buty skórzane" quantity="[1,1]" probability="0.5"/>
			<item value="puklerz" quantity="[1,1]" probability="0.5"/>
			<item value="nożyk" quantity="[1,1]" probability="0.5"/>
			<item value="butelka wody" quantity="[1,3]" probability="15.0"/>
		</drops>
		<equips>
		</equips>
		<ai>
			<says>
				<noise state="idle follow fight" value="Wrrrr! Hau!"/>
				<sound value="kobold-snort-01"/>
				<sound value="kobold_bark-01"/>
				<sound value="kobold_bark-02"/>
				<sound value="kobold_bark-03"/>
				<sound value="kobold_bark-04"/>
			</says>
			<profile name="brave"/>
			<profile name="offensive"/>
			<profile name="human"/>
			<profile name="patrolling"/>
		</ai>
	</creature>

	<creature name="kobold żołnierz">
		<type class="kobold" subclass="soldier_kobold" tileid="kobold.png:3"/>
		<description>Oto kobold żołnierz. Broni zaciekle swego króla.</description>
		<attributes>
			<atk value="93"/>
			<def value="20"/>
			<armor value="medium"/>
			<hp value="65"/>
			<speed value="0.5"/>
			<size value="1,1"/>
		</attributes>
		<level value="7"/>
		<experience value="70"/>
		<respawn value="1200"/>
		<corpse name="humanoid"/>
		<drops>
			<item value="money" quantity="[3,11]" probability="90.0"/>
			<item value="skórzana zbroja łuskowa" quantity="[1,1]" probability="10.0"/>
			<item value="zbroja ćwiekowa" quantity="[1,1]" probability="6.0"/>
			<item value="spodnie nabijane ćwiekami" quantity="[1,1]" probability="8.0"/>
			<item value="topór jednoręczny" quantity="[1,1]" probability="1.4"/>
			<item value="buty skórzane" quantity="[1,1]" probability="0.5"/>
			<item value="skórzany hełm" quantity="[1,1]" probability="1.0"/>
			<item value="drewniana tarcza" quantity="[1,1]" probability="1.3"/>
			<item value="pas kolczy" quantity="[1,1]" probability="1.5"/>
			<item value="mieczyk" quantity="[1,1]" probability="0.2"/>
		</drops>
		<equips>
		</equips>
		<ai>
			<says>
				<noise state="idle follow fight" value="Hau! Hauu!"/>
				<sound value="kobold-snort-01"/>
				<sound value="kobold_bark-01"/>
				<sound value="kobold_bark-02"/>
				<sound value="kobold_bark-03"/>
				<sound value="kobold_bark-04"/>
			</says>
			<profile name="brave"/>
			<profile name="offensive"/>
			<profile name="human"/>
			<profile name="patrolling"/>
		</ai>
	</creature>

	<creature name="kobold łucznik">
		<type class="kobold" subclass="archer_kobold" tileid="kobold.png:0"/>
		<description>Oto kobold łucznik, który trzyma się z daleka od napastnika.</description>
		<attributes>
			<atk value="94"/>
			<ratk value="94"/>
			<def value="28"/>
			<armor value="light"/>
			<hp value="40"/>
			<speed value="0.5"/>
			<size value="1,1"/>
		</attributes>
		<level value="8"/>
		<experience value="80"/>
		<respawn value="1200"/>
		<corpse name="humanoid"/>
		<drops>
			<item value="money" quantity="[3,10]" probability="90.0"/>
			<item value="skórzana zbroja łuskowa" quantity="[1,1]" probability="10.0"/>
			<item value="strzała" quantity="[3,12]" probability="6.0"/>
			<item value="buty skórzane" quantity="[1,1]" probability="0.5"/>
			<item value="drewniany sztylecik" quantity="[1,1]" probability="0.5"/>
			<item value="drewniany łuk" quantity="[1,1]" probability="0.5"/>
			<item value="złoty pas kolczy" quantity="[1,1]" probability="0.5"/>
		</drops>
		<equips>
			<slot name="lhand" item="strzała" quantity="10000" />
			<slot name="rhand" item="drewniany łuk" quantity="1" />
		</equips>
		<ai>
			<says>
				<noise state="idle follow fight" value="Hssss! Hau sss!"/>
				<sound value="kobold-snort-01"/>
				<sound value="kobold_bark-01"/>
				<sound value="kobold_bark-02"/>
				<sound value="kobold_bark-03"/>
				<sound value="kobold_bark-04"/>
			</says>
			<profile name="brave"/>
			<profile name="offensive"/>
			<profile name="human"/>
			<profile name="archer"/>
			<profile name="patrolling"/>
		</ai>
	</creature>

	<creature name="kobold weteran">
		<type class="kobold" subclass="veteran_kobold" tileid="kobold.png:4"/>
		<description>Oto kobold weteran. Nieźle włada bronią.</description>
		<attributes>
			<atk value="113"/>
			<def value="31"/>
			<armor value="medium"/>
			<hp value="50"/>
			<speed value="0.5"/>
			<size value="1,1"/>
		</attributes>
		<level value="9"/>
		<experience value="90"/>
		<respawn value="1200"/>
		<corpse name="humanoid"/>
		<drops>
			<item value="money" quantity="[3,13]" probability="90.0"/>
			<item value="drewniana tarcza" quantity="[1,1]" probability="10.0"/>
			<item value="tarcza płytowa" quantity="[1,1]" probability="50.0"/>
			<item value="kiścień" quantity="[1,1]" probability="10.0"/>
			<item value="skórzana zbroja" quantity="[1,1]" probability="10.0"/>
			<item value="topór" quantity="[1,1]" probability="2.0"/>
			<item value="nożyk" quantity="[1,1]" probability="0.7"/>
			<item value="buty nabijane ćwiekami" quantity="[1,1]" probability="0.5"/>
			<item value="skórzany hełm" quantity="[1,1]" probability="1.5"/>
			<item value="krótki miecz" quantity="[1,1]" probability="1.0"/>
			<item value="złoty pas kolczy" quantity="[1,1]" probability="1.0"/>
			<item value="butelka wody" quantity="[1,2]" probability="40.0"/>
		</drops>
		<equips>
		</equips>
		<ai>
			<says>
				<sound value="kobold-snort-01"/>
				<sound value="kobold_bark-01"/>
				<sound value="kobold_bark-02"/>
				<sound value="kobold_bark-03"/>
				<sound value="kobold_bark-04"/>
			</says>
			<profile name="brave"/>
			<profile name="offensive"/>
			<profile name="human"/>
			<profile name="patrolling"/>
		</ai>
	</creature>

	<creature name="kobold lider">
		<type class="kobold" subclass="leader_kobold" tileid="kobold.png:2"/>
		<description>Oto kobold lider. Jeden z wielkich wojowników.</description>
		<attributes>
			<atk value="139"/>
			<def value="39"/>
			<armor value="medium"/>
			<hp value="65"/>
			<speed value="0.5"/>
			<size value="1,1"/>
		</attributes>
		<level value="13"/>
		<experience value="314"/>
		<respawn value="1220"/>
		<corpse name="humanoid"/>
		<drops>
			<item value="money" quantity="[3,20]" probability="90.0"/>
			<item value="kolczuga" quantity="[1,1]" probability="8.0"/>
			<item value="kolczuga wzmocniona" quantity="[1,1]" probability="1.0"/>
			<item value="zbroja łuskowa" quantity="[1,1]" probability="0.05"/>
			<item value="żelazna zbroja łuskowa" quantity="[1,1]" probability="0.0050"/>
			<item value="topór bojowy" quantity="[1,1]" probability="1.5"/>
			<item value="buty kolcze" quantity="[1,1]" probability="1.5"/>
			<item value="buteleczka wody" quantity="[1,2]" probability="1.5"/>
			<item value="hełm kolczy" quantity="[1,1]" probability="3.0"/>
			<item value="tarcza płytowa" quantity="[1,1]" probability="0.5"/>
			<item value="pas kolczy" quantity="[1,1]" probability="2.0"/>
			<item value="butelka wody" quantity="[1,3]" probability="33.5"/>
		</drops>
		<equips>
		</equips>
		<ai>
			<says>
				<sound value="kobold-snort-01"/>
				<sound value="kobold_bark-01"/>
				<sound value="kobold_bark-02"/>
				<sound value="kobold_bark-03"/>
				<sound value="kobold_bark-04"/>
			</says>
			<profile name="brave"/>
			<profile name="offensive"/>
			<profile name="human"/>
			<profile name="attack weakest"/>
		</ai>
	</creature>

	<creature name="kobold olbrzymi">
		<type class="kobold" subclass="giant_kobold" tileid="kobold.png:5"/>
		<description>Oto kobold olbrzymi. Choć jest zabawny to nie jest świadomy swej siły. Kiedy zaproponuje przytulenie to najjlepiej jest odrzucić jego szczodrą ofertę.</description>
		<attributes>
			<atk value="440"/>
			<def value="57"/>
			<hp value="400"/>
			<speed value="1.0"/>
			<size value="2,2"/>
		</attributes>
		<level value="55"/>
		<experience value="2210"/>
		<respawn value="1650"/>
		<corpse name="giant_humanoid"/>
		<drops>
			<item value="money" quantity="[10,60]" probability="100.0"/>
			<item value="duży eliksir" quantity="[1,4]" probability="50.0"/>
			<item value="złota zbroja" quantity="[1,1]" probability="1.0"/>
			<item value="kropacz" quantity="[1,1]" probability="1.0"/>
		</drops>
		<equips>
		</equips>
		<ai>
			<says>
				<noise state="idle follow fight" value="Tulu?"/>
				<sound value="kobold-snort-01"/>
				<sound value="kobold_bark-01"/>
				<sound value="kobold_bark-02"/>
				<sound value="kobold_bark-03"/>
				<sound value="kobold_bark-04"/>
			</says>
			<profile name="status_attackers" params="StunnedStatus,5;"/>
			<profile name="brave"/>
			<profile name="animal"/>
			<profile name="offensive"/>
			<profile name="lifesteal" params="0.3"/>
			<profile name="heal" params="5,50"/>
			<profile name="patrolling"/>
		</ai>
	</creature>
	<!-- END: kobold -->
</creatures>
