<?xml version="1.0" encoding="UTF-8"?>
<creatures xmlns="stendhal" xmlns:xsi="http://www.w3.org/2001/XMLSchema-instance"
	xsi:schemaLocation="stendhal ../../creatures.xsd ">

	<creature name="risecia zbir">
		<type class="human" subclass="risecia_thug" tileid="human_risecia.png:1"/>
		<description>Oto risecia zbir. Trzymaj się od niego z daleka!</description>
		<attributes>
			<atk value="152"/>
			<def value="38"/>
			<armor_type value="medium"/>
			<hp value="60"/>
			<speed value="0.7"/>
			<size value="1,1"/>
		</attributes>
		<level value="12"/>
		<experience value="283"/>
		<respawn value="1210"/>
		<corpse name="humanoid"/>
		<drops>
			<item value="money" quantity="[3,20]" probability="90.0"/>
			<item value="kolczuga" quantity="[1,1]" probability="8.0"/>
			<item value="spodnie kolcze" quantity="[1,1]" probability="12.0"/>
			<item value="kolczuga wzmocniona" quantity="[1,1]" probability="1.3"/>
			<item value="kanapka" quantity="[1,1]" probability="1.5"/>
			<item value="buty kolcze" quantity="[1,1]" probability="1.0"/>
			<item value="peleryna" quantity="[1,1]" probability="0.5"/>
			<item value="hełm nabijany ćwiekami" quantity="[1,1]" probability="1.0"/>
			<item value="krótki miecz" quantity="[1,1]" probability="2.5"/>
			<item value="maczeta" quantity="[1,1]" probability="2.5"/>
		</drops>
		<equips>
		</equips>
		<ai>
			<profile name="brave"/>
			<profile name="offensive"/>
			<profile name="human"/>
			<profile name="patrolling"/>
		</ai>
	</creature>

	<creature name="risecia łucznik">
		<type class="human" subclass="risecia_archer" tileid="human_risecia.png:0"/>
		<description>Oto risecia łucznik. Jeden z wielu, którzy bronią swego dowódcę.</description>
		<attributes>
			<atk value="159"/>
			<ratk value="159"/>
			<def value="38"/>
			<armor_type value="medium"/>
			<hp value="70"/>
			<speed value="0.6"/>
			<size value="1,1"/>
		</attributes>
		<level value="14"/>
		<experience value="340"/>
		<respawn value="1220"/>
		<corpse name="humanoid"/>
		<drops>
			<item value="money" quantity="[2,15]" probability="100.0"/>
			<item value="zbroja łuskowa" quantity="[1,1]" probability="2.0"/>
			<item value="żelazna zbroja łuskowa" quantity="[1,1]" probability="0.5"/>
			<item value="strzała" quantity="[4,12]" probability="10.0"/>
			<item value="buty kolcze" quantity="[1,1]" probability="5.0"/>
			<item value="drewniany łuk" quantity="[1,1]" probability="5.0"/>
		</drops>
		<equips>
			<slot name="rhand" item="drewniany łuk" quantity="1"/>
			<slot name="lhand" item="strzała" quantity="10000"/>
		</equips>
		<ai>
			<profile name="offensive"/>
			<profile name="human"/>
			<profile name="archer"/>
			<profile name="patrolling"/>
		</ai>
	</creature>

	<creature name="risecia z klingą">
		<type class="human" subclass="risecia_swordsman" tileid="human_risecia.png:2"/>
		<description>Oto risecia z klingą. Jego ostrze miecza zetnie Twoją głowę!</description>
		<attributes>
			<atk value="194"/>
			<def value="27"/>
			<armor_type value="medium"/>
			<hp value="150"/>
			<speed value="0.8"/>
			<size value="1,1"/>
		</attributes>
		<level value="17"/>
		<experience value="425"/>
		<respawn value="1240"/>
		<corpse name="humanoid"/>
		<drops>
			<item value="money" quantity="[3,25]" probability="100.0"/>
			<item value="zbroja łuskowa" quantity="[1,1]" probability="5.0"/>
			<item value="żelazna zbroja łuskowa" quantity="[1,1]" probability="1.0"/>
			<item value="żelazny kirys z naramiennikami" quantity="[1,1]" probability="0.05"/>
			<item value="buty żelazne" quantity="[1,1]" probability="0.5"/>
			<item value="hełm kolczy" quantity="[1,1]" probability="5.0"/>
			<item value="miecz" quantity="[1,1]" probability="1.5"/>
		</drops>
		<equips>
		</equips>
		<ai>
			<profile name="brave"/>
			<profile name="offensive"/>
			<profile name="human"/>
			<profile name="patrolling"/>
		</ai>
	</creature>

	<creature name="Falatheen szef Risecia">
		<type class="human" subclass="risecia_leader" tileid="human_risecia.png:3"/>
		<description>Oto Falatheen szef Risecia. Nie chce zginąć! Jego mali wojownicy chronią go przed napastnikami.</description>
		<attributes>
			<atk value="209"/>
			<def value="22"/>
			<armor_type value="medium"/>
			<hp value="150"/>
			<speed value="0.9"/>
			<size value="1,1"/>
		</attributes>
		<level value="20"/>
		<experience value="503"/>
		<respawn value="1260"/>
		<corpse name="humanoid"/>
		<drops>
			<item value="money" quantity="[10,40]" probability="70.0"/>
			<item value="tarta" quantity="[1,1]" probability="5.0"/>
			<item value="żelazna zbroja łuskowa" quantity="[1,1]" probability="7.0"/>
			<item value="złota kolczuga" quantity="[1,1]" probability="2.0"/>
			<item value="żelazny kirys z naramiennikami" quantity="[1,1]" probability="0.5"/>
			<item value="buty kolcze" quantity="[1,1]" probability="6.0"/>
			<item value="peleryna" quantity="[1,1]" probability="5.0"/>
			<item value="misiurka" quantity="[1,1]" probability="1.0"/>
			<item value="bułat" quantity="[1,1]" probability="1.5"/>
		</drops>
		<equips>
		</equips>
		<ai>
			<profile name="offensive"/>
			<profile name="lifesteal" params="0.5"/>
			<profile name="human"/>
			<profile name="heal" params="5,50"/>
			<profile name="attack weakest"/>
		</ai>
	</creature>
</creatures>
