<?xml version="1.0" encoding="UTF-8"?>
<creatures xmlns="stendhal" xmlns:xsi="http://www.w3.org/2001/XMLSchema-instance"
	xsi:schemaLocation="stendhal ../../creatures.xsd ">

	<!-- START: animal -->
	<creature name="duch psa">
		<type class="undead" subclass="ghosthound" tileid="undead.png:13"/>
		<description>Dostrzegając kudłaty kształt i błyszczące złe spojrzenie to przypominasz sobie wszystkie opowieści grozy o duchu psa!</description>
		<attributes>
			<atk value="320"/>
			<def value="110"/>
			<hp value="110"/>
			<speed value="0.8"/>
			<size value="1,1"/>
			<resistance value="50"/>
			<visibility value="60"/>
		</attributes>
		<level value="45"/>
		<experience value="1250"/>
		<!-- once in 6 weeks, but two are in the world -->
		<respawn value="12096000"/>
		<corpse name="animal"/>
		<drops>
			<item value="rubin" quantity="[1,1]" probability="3.0"/>
		</drops>
		<equips>
			<slot name="rhand" item="sztylet mroku" quantity="1"/>
		</equips>
		<ai>
			<says>
				<noise state="idle follow fight" value="HaUuuu!"/>
				<noise state="fight" value="Grrrr!"/>
				<sound value="dog-snarl-1"/>
				<sound value="dog-snarl-2"/>
				<sound value="dog-angry-low-1"/>
			</says>
			<profile name="animal"/>
			<profile name="offensive"/>
			<profile name="patrolling"/>
			<profile name="lifesteal" params="0.05"/>
			<profile name="rare"/>
		</ai>
	</creature>
	<!-- END: animal -->

	<!-- START: misc -->
	<creature name="rycerz śmierci">
		<type class="undead" subclass="death_knight" tileid="undead.png:1"/>
		<description>Oto rycerz śmierci. Niegdyś walczył w wielu turniejach, w których jedynym zadaniem było zabić każdego przeciwnika.</description>
		<attributes>
			<atk value="421"/>
			<def value="52"/>
			<armor_type value="heavy"/>
			<hp value="500"/>
			<armor_hp value="125"/>
			<speed value="1.0"/>
			<size value="1,1"/>
			<resistance value="100"/>
			<visibility value="100"/>
		</attributes>
		<level value="52"/>
		<experience value="1920"/>
		<respawn value="1620"/>
		<corpse name="humanoid"/>
		<drops>
			<item value="money" quantity="[4,60]" probability="100.0"/>
			<item value="złota zbroja" quantity="[1,1]" probability="0.5"/>
			<item value="zbroja cieni" quantity="[1,1]" probability="0.0050"/>
			<item value="buty cieni" quantity="[1,1]" probability="1.5"/>
			<item value="hełm cieni" quantity="[1,1]" probability="0.35"/>
			<item value="miecz ognisty" quantity="[1,1]" probability="0.5"/>
			<item value="czarny sztylet" quantity="[1,1]" probability="1.0"/>
		</drops>
		<equips>
		</equips>
		<ai>
			<profile name="offensive"/>
			<profile name="human"/>
			<profile name="heal" params="5,50"/>
			<profile name="patrolling"/>
		</ai>
	</creature>

	<creature name="necrosophia">
		<type class="hybrid" subclass="necrosophia" tileid="hybrid.png:7"/>
		<description>Oto Necrosophia. Jest mocną bestią. Spali cię na popiół, gdy jesteś zdezorientowany przez magiczne fasolki.</description>
		<attributes>
			<atk value="1292"/>
			<def value="154"/>
			<armor_type value="none"/>
			<hp value="4118"/>
			<speed value="0.8"/>
			<size value="4,3"/>
		</attributes>
		<level value="250"/>
		<experience value="150000"/>
		<respawn value="3000"/>
		<corpse name="huger_animal" width="4" height="4"/>
		<drops>
			<item value="wielki eliksir" quantity="[1,2]" probability="50.0"/>
			<item value="płaszcz mainiocyjski" quantity="[1,1]" probability="2.5"/>
			<item value="hełm mainiocyjski" quantity="[1,1]" probability="2.0"/>
			<item value="spodnie mainiocyjskie" quantity="[1,1]" probability="2.5"/>
			<item value="buty mainiocyjskie" quantity="[1,1]" probability="2.5"/>
			<item value="tarcza mainiocyjska" quantity="[1,1]" probability="2.5"/>
			<item value="zbroja mainiocyjska" quantity="[1,1]" probability="1.0"/>
			<item value="rękawice mainiocyjskie" quantity="[1,1]" probability="1.0"/>
			<item value="pas mainiocyjski" quantity="[1,1]" probability="1.5"/>
			<item value="miecz mainiocyjski" quantity="[1,1]" probability="1.0"/>
		</drops>
		<equips>
		</equips>
		<abilities>
			<damage type="fire"/>
		</abilities>
		<ai>
			<profile name="status_attackers" params="StunnedStatus,10;"/>
			<profile name="brave"/>
			<profile name="animal"/>
			<profile name="offensive"/>
			<profile name="heal" params="30,50"/>
			<profile name="patrolling"/>
			<profile name="boss"/>
		</ai>
	</creature>
	<!-- END: misc -->

	<!-- START: specter -->
	<creature name="zielona zjawa">
		<type class="undead" subclass="green_phantom" tileid="undead.png:12"/>
		<attributes>
			<atk value="462"/>
			<def value="65"/>
			<armor_type value="none"/>
			<hp value="500"/>
			<speed value="0.8"/>
			<size value="1,1"/>
			<resistance value="50"/>
			<visibility value="50"/>
		</attributes>
		<level value="60"/>
		<experience value="2710"/>
		<respawn value="1700"/>
		<corpse name="humanoid"/>
		<drops>
			<item value="spodnie cieni" quantity="[1,1]" probability="0.3"/>
			<item value="bułat" quantity="[1,1]" probability="2.0"/>
			<item value="klinga orków" quantity="[1,1]" probability="2.0"/>
		</drops>
		<equips>
		</equips>
		<ai>
			<profile name="brave"/>
			<profile name="offensive"/>
			<profile name="human"/>
			<profile name="patrolling"/>
		</ai>
	</creature>
	<!-- END: specter -->
</creatures>
