<?xml version="1.0" encoding="UTF-8"?>
<creatures xmlns="stendhal" xmlns:xsi="http://www.w3.org/2001/XMLSchema-instance"
	xsi:schemaLocation="stendhal ../../creatures.xsd ">

	<!-- START: niesmiertelne -->
	<creature name="mgła">
		<type class="immortal" subclass="mgla" tileid="pol_niesmiertelne.png:0"/>
		<description>Mgła spowiła pobliskie otoczenie, musisz uważać na zjawy i inne upióry!</description>
		<attributes>
			<atk value="99"/>
			<def value="1"/>
			<hp value="1"/>
			<speed value="0.1"/>
			<size value="1,1"/>
			<resistance value="25"/>
			<visibility value="50"/>
		</attributes>
		<level value="0"/>
		<experience value="1"/>
		<respawn value="999"/>
		<corpse name="fly"/>
		<drops>
		</drops>
		<equips>
		</equips>
		<ai>
			<profile name="brave"/>
			<profile name="offensive"/>
			<profile name="human"/>
			<profile name="patrolling"/>
			<profile name="active_idle"/>
			<profile name="flying"/>
			<profile name="immortal"/>
		</ai>
	</creature>

	<creature name="trujące opary">
		<type class="immortal" subclass="trujace_opary" tileid="pol_niesmiertelne.png:1"/>
		<attributes>
			<atk value="199"/>
			<def value="1"/>
			<hp value="1"/>
			<speed value="0.1"/>
			<size value="1,1"/>
			<resistance value="25"/>
			<visibility value="50"/>
		</attributes>
		<level value="0"/>
		<experience value="1"/>
		<respawn value="999"/>
		<corpse name="fly"/>
		<drops>
		</drops>
		<equips>
		</equips>
		<ai>
			<profile name="poisonous" params="40,mocna trucizna"/>
			<profile name="brave"/>
			<profile name="offensive"/>
			<profile name="human"/>
			<profile name="attack weakest"/>
			<profile name="active_idle"/>
			<profile name="flying"/>
			<profile name="immortal"/>
		</ai>
	</creature>

	<creature name="trąba powietrzna">
		<type class="immortal" subclass="tornado" tileid="pol_niesmiertelne.png:2"/>
		<description>Oto trąba powietrzna. Pędź ile w sił w nogach, tornado gnie w tą samą stronę co ty!</description>
		<attributes>
			<atk value="20000"/>
			<def value="1"/>
			<hp value="1"/>
			<speed value="1.0"/>
			<size value="2,2"/>
			<resistance value="50"/>
			<visibility value="75"/>
		</attributes>
		<level value="800"/>
		<experience value="1"/>
		<respawn value="999"/>
		<corpse name="fly"/>
		<drops>
		</drops>
		<equips>
			<slot name="lhand" item="tarcza z mithrilu" quantity="1"/>
			<slot name="rhand" item="szczerbiec" quantity="1"/>
		</equips>
		<ai>
			<profile name="brave"/>
			<profile name="offensive"/>
			<profile name="human"/>
			<profile name="heal" params="5,50"/>
			<profile name="lifesteal" params="0.1"/>
			<profile name="patrolling"/>
			<profile name="active_idle"/>
			<profile name="flying"/>
			<profile name="immortal"/>
		</ai>
	</creature>

	<creature name="trąba wodna">
		<type class="immortal" subclass="tornado_wodne" tileid="pol_niesmiertelne.png:3"/>
		<attributes>
			<atk value="20000"/>
			<def value="1"/>
			<hp value="1"/>
			<speed value="1.0"/>
			<size value="2,2"/>
			<resistance value="50"/>
			<visibility value="75"/>
		</attributes>
		<level value="800"/>
		<experience value="1"/>
		<respawn value="999"/>
		<corpse name="fly"/>
		<drops>
		</drops>
		<equips>
			<slot name="lhand" item="tarcza z mithrilu" quantity="1"/>
			<slot name="rhand" item="szczerbiec" quantity="1"/>
		</equips>
		<ai>
			<profile name="brave"/>
			<profile name="offensive"/>
			<profile name="human"/>
			<profile name="heal" params="5,50"/>
			<profile name="lifesteal" params="0.1"/>
			<profile name="attack weakest"/>
			<profile name="active_idle"/>
			<profile name="flying"/>
			<profile name="immortal"/>
		</ai>
	</creature>
	<!-- END: niesmiertelne -->
</creatures>
