<?xml version="1.0" encoding="UTF-8"?>
<creatures xmlns="stendhal" xmlns:xsi="http://www.w3.org/2001/XMLSchema-instance"
	xsi:schemaLocation="stendhal ../../creatures.xsd ">

	<!-- START: gnome -->

	<creature name="gnom">
		<type class="gnome" subclass="gnome" tileid="gnome.png:0"/>
		<description>Oto gnom. Żyje w górach.</description>
		<attributes>
			<atk value="46"/>
			<def value="7"/>
			<armor value="light"/>
			<hp value="50"/>
			<speed value="0.5"/>
			<size value="1,1"/>
		</attributes>
		<level value="2"/>
		<experience value="20"/>
		<respawn value="900"/>
		<corpse name="tiny_humanoid" harmless="gnome" />
		<drops>
			<item value="money" quantity="[2,5]" probability="70.0"/>
			<item value="mały eliksir" quantity="[1,1]" probability="5.0"/>
			<item value="pieczarka" quantity="[3,6]" probability="10.0"/>
			<item value="skórzana zbroja" quantity="[1,1]" probability="10.0"/>
			<item value="puklerz" quantity="[1,1]" probability="5.0"/>
		</drops>
		<equips>
		</equips>
		<ai>
			<says>
				<noise state="idle follow fight" value="Gigaaaanty! Uciekaaaaj!"/>
			</says>
			<profile name="offensive"/>
			<profile name="coward"/>
			<profile name="human"/>
			<profile name="patrolling"/>
		</ai>
	</creature>

	<creature name="panna gnom">
		<type class="gnome" subclass="woman_gnome" tileid="gnome.png:1"/>
		<description>Oto panna gnom. Wciąż poleruje skały w górach.</description>
		<attributes>
			<atk value="47"/>
			<def value="7"/>
			<armor value="light"/>
			<hp value="50"/>
			<speed value="0.5"/>
			<size value="1,1"/>
		</attributes>
		<level value="2"/>
		<experience value="20"/>
		<respawn value="900"/>
		<corpse name="tiny_humanoid" harmless="gnome" />
		<drops>
			<item value="money" quantity="[2,5]" probability="70.0"/>
			<item value="buteleczka wody" quantity="[1,3]" probability="30.0"/>
			<item value="antidotum" quantity="[1,1]" probability="10.0"/>
			<item value="borowik" quantity="[1,10]" probability="10.0"/>
			<item value="skórzana zbroja" quantity="[1,1]" probability="10.0"/>
		</drops>
		<equips>
		</equips>
		<ai>
			<says>
				<noise state="idle follow fight" value="Gigaaaanty! Uciekaaaajmy!"/>
			</says>
			<profile name="offensive"/>
			<profile name="coward"/>
			<profile name="human"/>
			<profile name="patrolling"/>
		</ai>
	</creature>

	<!-- END: gnome -->

	<!-- START: militant -->

	<creature name="gnom zwiadowca">
		<type class="gnome" subclass="infantryman" tileid="gnome.png:2"/>
		<description>Oto gnom zwiadowca. Będzie bronił wioski póki... nie ucieknie.</description>
		<attributes>
			<atk value="58"/>
			<def value="15"/>
			<armor value="light"/>
			<hp value="60"/>
			<speed value="0.5"/>
			<size value="1,1"/>
		</attributes>
		<level value="5"/>
		<experience value="50"/>
		<respawn value="1200"/>
		<corpse name="tiny_humanoid" harmless="gnome_military" />
		<drops>
			<item value="money" quantity="[4,10]" probability="70.0"/>
			<item value="marchew" quantity="[2,10]" probability="20.0"/>
			<item value="borowik" quantity="[1,10]" probability="10.0"/>
			<item value="buteleczka wody" quantity="[1,4]" probability="25.0"/>
			<item value="butelka wody" quantity="[1,2]" probability="15.0"/>
			<item value="proca" quantity="[1,1]" probability="10.0"/>
		</drops>
		<equips>
			<slot name="rhand" item="sztylecik"/>
		</equips>
		<ai>
			<says>
				<noise state="idle follow fight" value="Gotowy, aby uciekać?"/>
			</says>
			<profile name="brave"/>
			<profile name="offensive"/>
			<profile name="human"/>
			<profile name="patrolling"/>
		</ai>
	</creature>

	<creature name="gnom kawalerzysta">
		<type class="gnome" subclass="cavalryman" tileid="gnome.png:3"/>
		<description>Oto gnom kawalerzysta. Zapuszcza się daleko szukając złota.</description>
		<attributes>
			<atk value="90"/>
			<def value="14"/>
			<armor value="medium"/>
			<hp value="65"/>
			<speed value="0.5"/>
			<size value="1,1"/>
		</attributes>
		<level value="5"/>
		<experience value="50"/>
		<respawn value="1200"/>
		<corpse name="tiny_humanoid" harmless="gnome_military" />
		<drops>
			<item value="money" quantity="[6,14]" probability="70.0"/>
			<item value="buty kolcze" quantity="[1,1]" probability="15.0"/>
			<item value="kapelusz leśniczego" quantity="[1,1]" probability="20.0"/>
			<item value="buteleczka wody" quantity="[1,3]" probability="25.0"/>
			<item value="butelka wody" quantity="[1,2]" probability="15.0"/>
			<item value="skóra zwierzęca" quantity="[1,1]" probability="6.0"/>
			<item value="proca" quantity="[1,1]" probability="40.0"/>
		</drops>
		<equips>
		</equips>
		<ai>
			<says>
				<noise state="idle follow fight" value="Przygotowany do ucieczki?"/>
				<sound value="pig-squeal-01"/>
			</says>
			<profile name="brave"/>
			<profile name="offensive"/>
			<profile name="human"/>
			<profile name="patrolling"/>
		</ai>
	</creature>

	<!-- END: militant -->

	<!-- START: giant -->

	<creature name="olbrzymi gnom">
		<type class="gnome" subclass="gnome_giant" tileid="gnome.png:4"/>
		<description></description>
		<attributes>
			<atk value="322"/>
			<def value="79"/>
			<armor value="medium"/>
			<hp value="720"/>
			<speed value="0.9"/>
			<size value="1,1"/>
		</attributes>
		<level value="74"/>
		<experience value="4750"/>
		<respawn value="2420"/>
		<corpse name="humanoid"/>
		<drops>
			<item value="money" quantity="[6,50]" probability="70.0"/>
			<item value="eliksir" quantity="[1,1]" probability="20.0"/> 
			<item value="borowik" quantity="[1,10]" probability="10.0"/>
		</drops>
		<ai>
			<profile name="status_attackers" params="StunnedStatus,6;"/>
			<profile name="brave"/>
			<profile name="offensive"/>
			<profile name="patrolling"/>
		</ai>
	</creature>

	<creature name="olbrzymia panna gnom">
		<type class="gnome" subclass="gnomess_giant" tileid="gnome.png:5"/>
		<description></description>
		<attributes>
			<atk value="332"/>
			<def value="83"/>
			<armor value="medium"/>
			<hp value="760"/>
			<speed value="0.9"/>
			<size value="1,1"/>
		</attributes>
		<level value="76"/>
		<experience value="5200"/>
		<respawn value="2520"/>
		<corpse name="humanoid"/>
		<drops>
			<item value="money" quantity="[6,50]" probability="70.0"/>
			<item value="eliksir" quantity="[1,1]" probability="20.0"/> 
			<item value="borowik" quantity="[1,10]" probability="10.0"/>
		</drops>
		<ai>
			<profile name="status_attackers" params="StunnedStatus,6;"/>
			<profile name="brave"/>
			<profile name="offensive"/>
			<profile name="patrolling"/>
		</ai>
	</creature>

	<!-- END: giant -->
</creatures>
