<?xml version="1.0" encoding="UTF-8"?>
<creatures xmlns="stendhal" xmlns:xsi="http://www.w3.org/2001/XMLSchema-instance"
	xsi:schemaLocation="stendhal ../../creatures.xsd ">

	<!-- START: serafiny -->
	<creature name="serafin">
		<type class="angel" subclass="serafin" tileid="pol_serafiny.png:0"/>
		<description>Oto serafin. Anioł najwyższego rzędu, strzęgącego tronu Niebios.</description>
		<attributes>
			<atk value="8888"/>
			<ratk value="8888"/>
			<def value="362"/>
			<armor value="heavy"/>
			<hp value="9000"/>
			<speed value="1.0"/>
			<size value="3,3"/>
		</attributes>
		<level value="880"/>
		<experience value="763000"/>
		<respawn value="190000"/>
		<corpse name="giant_humanoid"/>
		<drops>
			<item value="money" quantity="[100,20000]" probability="100.0"/>
			<item value="gigantyczny eliksir" quantity="[1,9]" probability="40.0"/>
			<item value="miecz nieśmiertelnych" quantity="[1,1]" probability="3.0"/>
			<item value="rękawice z mithrilu" quantity="[1,1]" probability="0.3"/>
			<item value="pas z mithrilu" quantity="[1,1]" probability="0.5"/>
			<item value="pióro serafina" quantity="[1,1]" probability="85.0"/>
			<item value="magia światła" quantity="[11,99]" probability="100.0"/>
			<item value="różdżka Wołosa" quantity="[1,1]" probability="20.0"/>
			<item value="pierścień z mithrilu" quantity="[1,1]" probability="0.1"/>
			<item value="kosa z mithrilu" quantity="[1,1]" probability="0.3"/>
		</drops>
		<equips>
			<slot name="lhand" item="magia światła" quantity="10000"/>
			<slot name="rhand" item="różdżka Peruna" quantity="1"/>
		</equips>
		<abilities>
			<damage type="light"/>
			<susceptibility type="dark" value="1.2"/>
			<susceptibility type="light" value="0.7"/>
		</abilities>
		<ai>
			<says>
				<noise state="idle follow fight" value="Niech twa dusza powróci na ziemię!"/>
			</says>
			<profile name="bleeding_attack" params="5"/>
			<profile name="brave"/>
			<profile name="archer"/>
			<profile name="offensive"/>
			<profile name="heal" params="10,50"/>
			<profile name="lifesteal" params="0.1"/>
			<profile name="attack weakest"/>
			<profile name="boss"/>
		</ai>
	</creature>

	<creature name="azazel">
		<type class="angel" subclass="azazel" tileid="pol_serafiny.png:1"/>
		<description>Oto azazel. Pomimo upadku wciąż jest uznawany za jednego z potężnych aniołów!</description>
		<attributes>
			<atk value="12222"/>
			<ratk value="12222"/>
			<def value="666"/>
			<armor value="heavy"/>
			<hp value="9000"/>
			<speed value="1.0"/>
			<size value="3,3"/>
		</attributes>
		<level value="990"/>
		<experience value="963000"/>
		<respawn value="190000"/>
		<corpse name="giant_humanoid"/>
		<drops>
			<item value="money" quantity="[100,30000]" probability="100.0"/>
			<item value="gigantyczny eliksir" quantity="[1,9]" probability="40.0"/>
			<item value="czarny miecz" quantity="[1,1]" probability="5.0"/>
			<item value="czarne rękawice" quantity="[1,1]" probability="5.0"/>
			<item value="czarny pas" quantity="[1,1]" probability="1.0"/>
			<item value="pióro azazela" quantity="[1,1]" probability="85.0"/>
			<item value="magia mroku" quantity="[11,99]" probability="90.0"/>
			<item value="różdżka Peruna" quantity="[1,1]" probability="0.3"/>
			<item value="czarny pierścień" quantity="[1,1]" probability="0.2"/>
			<item value="pierścień niewidzialności" quantity="[1,1]" probability="0.1"/>
		</drops>
		<equips>
			<slot name="lhand" item="magia mroku" quantity="10000"/>
			<slot name="rhand" item="różdżka Peruna" quantity="1"/>
		</equips>
		<abilities>
			<damage type="dark"/>
			<susceptibility type="dark" value="0.7"/>
			<susceptibility type="light" value="1.2"/>
		</abilities>
		<ai>
			<says>
				<noise state="idle follow fight" value="Syn ognia nie będzie się kłaniał synowi ziemi!"/>
			</says>
			<profile name="bleeding_attack" params="5"/>
			<profile name="brave"/>
			<profile name="archer"/>
			<profile name="offensive"/>
			<profile name="heal" params="15,50"/>
			<profile name="lifesteal" params="0.2"/>
			<profile name="attack weakest"/>
			<profile name="boss"/>
		</ai>
	</creature>

	<creature name="cherubin">
		<type class="angel" subclass="cherubin" tileid="pol_serafiny.png:2"/>
		<description>Oto cherubin. Stojąca wysoko w hierarchii i potężna istota nadprzyrodzona, strzegąca ludzi przed demonami.</description>
		<attributes>
			<atk value="24444"/>
			<ratk value="24444"/>
			<def value="776"/>
			<armor value="heavy"/>
			<hp value="20000"/>
			<speed value="1.0"/>
			<size value="3,3"/>
		</attributes>
		<level value="1100"/>
		<experience value="1718000"/>
		<respawn value="380000"/>
		<corpse name="giant_humanoid"/>
		<drops>
			<item value="money" quantity="[100,40000]" probability="100.0"/>
			<item value="gigantyczny eliksir" quantity="[2,14]" probability="40.0"/>
			<item value="pióro cherubina" quantity="[1,1]" probability="90.0"/>
			<item value="magia mrozu" quantity="[11,222]" probability="100.0"/>
			<item value="różdżka Wołosa" quantity="[1,1]" probability="5.0"/>
			<item value="magiczny topór obosieczny" quantity="[1,1]" probability="3.0"/>
			<item value="zbroja z mithrilu" quantity="[1,1]" probability="0.5"/>
			<item value="hełm z mithrilu" quantity="[1,1]" probability="0.7"/>
			<item value="pierścień z mithrilu" quantity="[1,1]" probability="0.25"/>
			<item value="rękawice z mithrilu" quantity="[1,1]" probability="0.7"/>
			<item value="kosa z mithrilu" quantity="[1,1]" probability="0.5"/>
			<item value="miecz z mithrilu" quantity="[1,1]" probability="0.5"/>
			<item value="sztylecik z mithrilu" quantity="[1,1]" probability="0.3"/>
		</drops>
		<equips>
			<slot name="lhand" item="magia światła" quantity="10000"/>
			<slot name="rhand" item="różdżka Peruna" quantity="1"/>
		</equips>
		<abilities>
			<damage type="ice"/>
			<susceptibility type="ice" value="0.6"/>
			<susceptibility type="water" value="1.2"/>
			<susceptibility type="fire" value="1.2"/>
		</abilities>
		<ai>
			<says>
				<noise state="idle follow fight" value="Grzechy twej duszy ranią naszego Stwórcę!"/>
			</says>
			<profile name="bleeding_attack" params="5"/>
			<profile name="brave"/>
			<profile name="archer"/>
			<profile name="offensive"/>
			<profile name="heal" params="20,100"/>
			<profile name="lifesteal" params="0.3"/>
			<profile name="attack weakest"/>
			<profile name="boss"/>
		</ai>
	</creature>

	<creature name="lilith">
		<type class="angel" subclass="lilith" tileid="pol_serafiny.png:3"/>
		<description>Oto lilith. Jedna z najpotężniejszych upiorzyc, demonów oraz niezwykle groźna.</description>
		<attributes>
			<atk value="28888"/>
			<ratk value="28888"/>
			<def value="827"/>
			<hp value="24000"/>
			<speed value="1.0"/>
			<size value="3,3"/>
		</attributes>
		<level value="1210"/>
		<experience value="1918000"/>
		<respawn value="380000"/>
		<corpse name="giant_humanoid"/>
		<drops>
			<item value="money" quantity="[666,66666]" probability="100.0"/>
			<item value="gigantyczny eliksir" quantity="[3,21]" probability="40.0"/>
			<item value="pióro lilith" quantity="[1,1]" probability="90.0"/>
			<item value="magia mroku" quantity="[11,99]" probability="100.0"/>
			<item value="tarcza cieni" quantity="[1,1]" probability="1.5"/>
			<item value="czarna halabarda" quantity="[1,1]" probability="1.0"/>
			<item value="różdżka Peruna" quantity="[1,1]" probability="0.8"/>
			<item value="czarny hełm" quantity="[1,1]" probability="2.5"/>
			<item value="piekielny sztylet" quantity="[1,1]" probability="4.0"/>
			<item value="młot wulkanów" quantity="[1,1]" probability="0.5"/>
			<item value="czarna kosa" quantity="[1,1]" probability="1.0"/>
			<item value="czarny pierścień" quantity="[1,1]" probability="1.0"/>
			<item value="pierścień niewidzialności" quantity="[1,1]" probability="0.3"/>
		</drops>
		<equips>
			<slot name="lhand" item="magia mroku" quantity="10000"/>
			<slot name="rhand" item="różdżka Peruna" quantity="1"/>
		</equips>
		<abilities>
			<damage type="fire"/>
			<susceptibility type="water" value="1.2"/>
			<susceptibility type="ice" value="1.2"/>
			<susceptibility type="fire" value="0.6"/>
		</abilities>
		<ai>
			<says>
				<noise state="idle follow fight" value="Jestem wszystkim, czego nie możesz kontrolować."/>
				<noise state="idle follow fight" value="Precz stąd nim spojrzę!"/>
			</says>
			<profile name="bleeding_attack" params="5"/>
			<profile name="brave"/>
			<profile name="archer"/>
			<profile name="offensive"/>
			<profile name="heal" params="10,70"/>
			<profile name="lifesteal" params="0.4"/>
			<profile name="attack weakest"/>
			<profile name="boss"/>
		</ai>
	</creature>
	<!-- END: serafiny -->
</creatures>
